review_id,app,platform,rating,title,body,date,version,username
14251984749,Cardoc,ios,5,처음 사용했어요,엔진오일 교체하는데 처음 사용했는데 가격도 저렴하고 좋습니다.,2026-07-01T19:50:45-07:00,10.0.3,sleepy33
14226868398,Cardoc,ios,5,믿고 쓰는 카닥!!,항상 만족하며 믿고 쓰는 카닥입니다. 👍,2026-06-25T19:11:20-07:00,10.0.3,codemaster2k
14081104171,Cardoc,ios,5,제미아이가 카닥을 알려줬어요~~,"차가 스크래치만 나도 수리 전까지 기분이 언짢은 것은 누구나 마찬가지일 것입니다. 며칠을 언짢게 지내다가 제미나이한테 물어보니 ”어플 카닥으로 견적내면 가깝고 저렴한 곳을 선택할 수 있다“. 고 하여 견적요청하니 4곳에서 30분 이내 견적을 받았습니다. 제일 빠르고 저렴한곳이 “블루자동차”였습니다. 혹시나 싼게 비지떡 아닐까? 의심이 살짝 들었으나 반전~~, 빠르고(입고+1일), 친절하고, 저렴하고, 완벽하게 완료됐습니다. 블루자동차(안동욱 팀장님) 감사합니다. 

-수리내용
 
팰리세이드 트렁크 문(함몰), 리얼 범퍼 상단 (도색), 리어범퍼 하단 교체(깨짐),앞범퍼 조수석 측면 교체(깨짐)",2026-05-19T00:06:01-07:00,10.0.1,기회의땅
14033833130,Cardoc,ios,5,덴트수리,카닥 항상 믿고 이용하고 있습니다!,2026-05-06T02:26:18-07:00,10.0.1,bankloanshark
14024324000,Cardoc,ios,5,여기저기 발품안팔아도되서 편함,제일 저렴한 업체부터 비싼 업체까지 알아서 견적이 와서 비교선택만 하면 되는게 편하고. 견적은 차를 맡기고 나서 올라갈 수 있다는 점.. 유의,2026-05-03T09:21:27-07:00,10.0.1,ZyaRico
14011384654,Cardoc,ios,5,오.. 좋네요,이런앱있는지 몰랐는데 편하게 잘썼어요~,2026-04-29T20:17:30-07:00,10.0.1,아리가또뉴
13918253358,Cardoc,ios,3,타이어,이제 타이어 견적은 없애버린건가요?  아예 안보이네요. 나름 괜찮았는데,2026-04-03T08:25:30-07:00,10.0.1,투표결과가그게뭐니
13909343705,Cardoc,ios,5,혹시 앱리뉴얼 언제까지 하시나요?,엔진오일 교환 예약 해야해서요 ..,2026-03-31T21:23:57-07:00,9.0.24,comicsje
13905174015,Cardoc,ios,1,로그인도 안되는데,"회원가입만 되고 로그인도 안되는데
어떻게 쓰라고 만든건지..",2026-03-30T17:17:39-07:00,9.0.24,회원유치목적
13899184666,Cardoc,ios,1,최악,"무슨ㅋㅋㅋㅋㅋㅋㅋㅋ앱이 시작이 안돼요? 와이파이 네칸 데이터 네칸 다 차있는데 뭘 자꾸 네트워크를 점검하라고 하고, 겨우 넘어가면 또 약관 동의에 실패했다고 뜨네요? 약관 동의에 실패했다는 문장을 태어나서 처음 보는데 누구를 동의버튼 하나 못누르는 저지능 장애인으로 만들어버리면 어떡해요. 어플 좀 갈아엎든 점검하든 뭐라도 좀 하세요",2026-03-29T01:54:51-07:00,9.0.24,앱등2년차
13898887629,Cardoc,ios,1,가입자체가 안되네요,"카카오 네이버 뭐 둘다 안되고 가입절차넘어가면 약관동의실패뜨고 
아에 앱 사용 자체가 안되네요",2026-03-28T23:31:58-07:00,9.0.24,리뷰안남기는데개빡치네진짜
13870192922,Cardoc,ios,5,엔진오일 교체,앱에서 결제하고 너무 편하네요,2026-03-20T20:42:41-07:00,9.0.24,cambrich
13863008544,Cardoc,ios,5,좋아요,편리하고 좋습니다,2026-03-18T18:45:02-07:00,9.0.24,굿굿굿 유저
13861811408,Cardoc,ios,5,역시,일일히 찾아다니며 비교견적 받을일없이 차량파손부위 사진만으로도 다양한 견적을 받아볼수있어서 편리하네요. 가까운 지역을 선택해서 견적을 받을수도 있어서 더더욱 좋구요. 차량수리도 잘 되서 만족합니다,2026-03-18T10:38:50-07:00,9.0.24,짱푸
13853454621,Cardoc,ios,4,몇번이용해봤는데 만족합니다.,수리비 비교도 가능하고 생각보다 말끔하게 수리 잘해주십니다. 만족합니다.,2026-03-16T00:52:25-07:00,9.0.24,lunyblue4556
13849210595,Cardoc,ios,5,외장수리의최고의앱,최고의카닥터카닥.,2026-03-14T18:58:32-07:00,9.0.24,영등포망치
13835444770,Cardoc,ios,1,개 쓰레기 업체입니다,"타이어 절대 바꾸지 마세요

타이어 교체 시 추가 요청사항에 윈터타이어 보관해달라고 요청사항 적어놨는데 보지도 않아놓고 업체에서는 보관 안해준다고 하고 취소한다고 하니 고객에게 타이어 배송비 6만원을 부과하는 양아치 업체입니다

절대 피해보지 마세요",2026-03-10T19:15:48-07:00,9.0.24,sehyeon14
13832336136,Cardoc,ios,5,정말 좋은 어플,너무 유용하게 잘 사용했습니다! 역시 한국 최고~!,2026-03-09T20:56:32-07:00,9.0.24,은진이
13829293137,Cardoc,ios,5,수리후기,매우 좋습니다,2026-03-08T23:41:00-07:00,9.0.24,uchany1008
13828691920,Cardoc,ios,5,추천,믿을만한 업체 수배가 편리합니다.,2026-03-08T18:29:01-07:00,9.0.24,shy2shy
13793968307,Cardoc,ios,1,개불ㅍᆢㅑㄴ,ㅛㅜㅜㅡ,2026-02-26T23:31:56-07:00,9.0.24,으ll2
13722159216,Cardoc,ios,5,엔진오일교체,잘받았어요,2026-02-07T00:06:37-07:00,9.0.24,앙이다1
13688231497,Cardoc,ios,1,별로,카닥 앱 내에서 수리 비용 지불하고 업체 방문해보면 추가비용 받음. 확인해 보면 놓치기 쉬운 작은 글씨로 비용 추가될 수 있음 써있음. 고객센터는 불친절.,2026-01-28T23:59:11-07:00,9.0.24,djrhrurirkekd
13683831088,Cardoc,ios,1,양아치 업체 밖에 없음,견적 뻥튀기 과수리요구 차량 입고 시키면 어디든 견적이랑 달라짐,2026-01-27T19:43:41-07:00,9.0.24,나다블리
13681347229,Cardoc,ios,1,견적 그만,그만받고싶은데,2026-01-27T04:57:07-07:00,9.0.24,Always_Awake
13665903471,Cardoc,ios,1,이렇게 편할 수가,편리한 어플입니다. 총알만 준비하면 됩니다^^,2026-01-23T02:59:29-07:00,9.0.24,길동이이이이
13623371410,Cardoc,ios,1,업체선정,후기만 좋은식으로 포장하고 개판업체 피해받음,2026-01-11T18:03:24-07:00,9.0.24,김성도
13499256471,Cardoc,ios,1,카닥,중개업체로서의 역할을 제대로 못함,2025-12-10T16:22:49-07:00,9.0.24,존재이유를못찾겠음
13488097027,Cardoc,ios,5,최고,편리하고 좋아요,2025-12-07T17:08:28-07:00,9.0.24,goose00135
13449169245,Cardoc,ios,4,엔진오일교환,Good,2025-11-27T19:36:22-07:00,9.0.24,둘리스7
13366656144,Cardoc,ios,5,예약이 편해요^^,앱으로 예약하기도 편하고 평점 보고 갈 수 있어서 좋네요~~^^,2025-11-06T22:53:52-07:00,9.0.24,ana6812
13332677259,Cardoc,ios,5,자동차 수리시 강추 합니다.,"차량 수리시 일반인들은 수리 절차와 비용에 대해 잘 알지 못하고, 또한 업체마다 비용견적이 다른데 일일히 방문하여 견적을 알아보기도 어려운게 현실입니다. 카닥을 이용하여 이번에 수리후 대만족 하였습니다.",2025-10-30T01:23:35-07:00,9.0.24,브아앙1
13324844945,Cardoc,ios,2,결제쪽은 오류가 겁나게 많음,결제쪽은 오류가 겁나게 많음. 토스뱅크로 결제한다고하니 하나은행으로 넘어가고..,2025-10-28T05:04:07-07:00,9.0.23,쿠루르기스자크
13255240028,Cardoc,ios,5,예약 관리,주변 저렴 한 것을 추천해서 잘 컨택이 되었어,2025-10-11T20:32:07-07:00,9.0.23,스페셜80
13212772297,Cardoc,ios,1,추천 공업사 갔는데...,추천 공업사 가서 두번 수리 받음. 차에 기스가 더 생김... 그냥 포기함,2025-10-02T01:49:05-07:00,9.0.22,답답하네... 어휴
13142903560,Cardoc,ios,5,하나 건의드립니다~~,맘에 드는 공업소를 즐겨찾기 할 수 있는 기능이 있으면 좋겠습니다!,2025-09-15T20:41:21-07:00,9.0.20,차가운포도
13120135104,Cardoc,ios,5,엔진오일교환,항상 만족합니다,2025-09-10T01:33:06-07:00,9.0.20,애나가
13108976616,Cardoc,ios,5,좋네요,엔진오일종류가 많아서 선택의 폭이 넓어서 좋습니다,2025-09-07T02:40:24-07:00,9.0.20,달의시인
13058176174,Cardoc,ios,1,견적요청,견적 요청 후 해당 내용을 지우지 않는 한 다른 견적을 요청할 수 없음. 견적 요청 또한 지울 수 없음.,2025-08-25T03:15:11-07:00,9.0.20,아나랴다너
12933521973,Cardoc,ios,5,미사 그렌저 리뷰,"사장님께서 픽업도 편리하게 해주시고 , 무엇보다 저렴한 금액에 진행해주셔서 근무시간에 마음편히 수리 맡겼습니다 !",2025-07-24T22:59:39-07:00,9.0.19,엘지베스트샵
12916968136,Cardoc,ios,5,만족스러움,"아주  만족함
오일 교체 때문에  간만에  이용했는데  친절하고 믿을만함",2025-07-20T20:51:21-07:00,9.0.19,주나제이
12905089846,Cardoc,ios,1,불편한 시스템,"견적 삭제, 수정이 안됩니다. 사용자로서는 상당히 불편한 시스템 일 수 밖에 없습니다. 6월 중순 차량 기스로 수리를 하고 7월 집중호우로 차량점검이 필요한 상황인데 견적이 만료되지 않았다고 견적을 받을 수 없다고 합니다. 해당 시스템에 대해서는 개선이 필요할 것 같습니다.",2025-07-17T20:33:20-07:00,9.0.19,ikpaaaak
12870405017,Cardoc,ios,5,카닥 꼭 하세요.,"엔진오일 교환하는거 가격 때문에 은근 스트레스였는데,
차 번호만 넣으면 차량 자동 조회 되서 오일 종류도 비교 선택 가능하고, 정비소도 비교 선택 가능하니 신세계네요. 차알못 여자들이 이용하기 딱 좋아요.",2025-07-09T01:49:05-07:00,9.0.18,리노이나
12853951090,Cardoc,ios,5,좋음,좋습니다!,2025-07-04T21:17:45-07:00,9.0.18,kshkhj
12764775422,Cardoc,ios,5,대만족입니다,조수석 뒤쪽 도어가 다 긁혀서 카닥을 통해서 견적 받고 상담을 했는데 사장님이 친절하게 응대해주셔서 믿고 맡겼습니다 도금이랑 몰딩까지 깔끔하게 잘 되었습니다 픽업서비스까지 있어서 너무 편했습니다~~,2025-06-12T00:23:02-07:00,9.0.15,지성녀
12738144575,Cardoc,ios,5,좋아요,카닥 어플 좋아요 발로 안 뛰어도 되고 알아서 정비업체가 견적 내주니깐 너무 편하고 좋아요,2025-06-05T03:04:42-07:00,9.0.12,김웅패
12661666784,Cardoc,ios,1,수리시스템은 좋음,앱이나 사이트 직관성은 진짜 최악중에 최악,2025-05-16T02:09:21-07:00,9.0.10,리또누
12661350450,Cardoc,ios,5,굿,속도가 느린거빼고는 좋아요,2025-05-15T23:36:06-07:00,9.0.10,남씨2
12650567495,Cardoc,ios,1,카닥,견적서 삭제도 안되는 거지같은 앱,2025-05-12T23:42:49-07:00,9.0.10,블랭크홀
12558679672,Cardoc,ios,1,별로입니다,외장수리 하지마세요,2025-04-18T10:58:39-07:00,9.0.10,ㅎㅎㅎㅎ류지
10834864117,Cardoc,ios,5,감사합니다,사고 나서 접수 받으시자마자 바로 보러 와주시고 정확한 일정과 수리 후에도 갖다주시고 감사합니다 꼼꼼한 수리도 중요하지만 서비스와 대처도 중요하다 생각하는데 만족스러운 수리였어요 사고가 안 난다면 베스트지만 담에 이용할 일 생긴다면 꼭 재방문 하겠습니다!!,2024-01-17T23:35:34-07:00,8.1.3,Soobin2927
10830654915,Cardoc,ios,1,견적 받을 수 없다는 메세지만..,휀다 긁히고 찌그러진 곳 사진 찍어서 올렸는데 외장 긁히고 찌그러진게 아니라고 견적 받을 수 없다는 메세지만 오는데?,2024-01-16T19:11:29-07:00,8.1.3,니취나알?
10830364485,Cardoc,ios,5,비교견적,"타업체 견적으로 합리적인 작업을 했네요. 어플 마음에
들어요",2024-01-16T17:10:26-07:00,8.1.3,Jaehkims
10828784282,Cardoc,ios,5,친절한 서비스 완벽한 수리,집앞에서 약속한 시간에 픽업해주시고 완벽한 수리후 세차까지 해주시고 다시 집앞까지 가져다 주셔서 감사합니다. 수리가 필요 하신분들 강력 추천합니다.,2024-01-16T07:18:20-07:00,8.1.3,hyun981
10826913700,Cardoc,ios,5,엔진 오일 교환건,차에 대한 지식과 친절 마인드를 탑재하신 보기드문 사장님 입니다. 재방문 예정,2024-01-15T18:24:49-07:00,8.1.3,우마왕짱
10811692109,Cardoc,ios,5,만족,참좋은 어플인듯 합니다,2024-01-11T18:00:07-07:00,8.1.3,찰리구
10797747450,Cardoc,ios,5,정말 친절하고 빠르게 처리해주셨습니다!,"정말 친절하시고 감사하게도 저렴한가격에 픽업까지!
완존 감사하고 감사합니다 번창하세요!",2024-01-07T23:47:14-07:00,8.1.3,망겜보면짖음
10789620104,Cardoc,ios,5,자주이용하는 어플,차를 좋아하는 나에게 꼭 필요한 어플이다.,2024-01-05T21:44:12-07:00,8.1.3,DO$Hunter
10784773501,Cardoc,ios,5,신속한 견적 상담으로 하루 만에 차 수리 받음,사고 후 멘붕이었는데 제 차랑 상대편 차 수리 견적 시세 받고 보험/비보험 처리 여부를 선택할 수 있었습니다. 소개받은 공업사들도 친절하고 앱 서비스에 만족합니다.,2024-01-04T15:50:43-07:00,8.1.3,hpton
10778279718,Cardoc,ios,5,점점 좋아지네요~!,카닥.. 점점 좋라지네요~!,2024-01-03T02:43:17-07:00,8.1.3,유리스트1
10777137513,Cardoc,ios,5,엔진오일교환,편하고 좋아요,2024-01-02T19:00:37-07:00,8.1.3,Cocobini
10766011701,Cardoc,ios,5,타깃 최고,처음 이용했는데 참 좋은 서비스인가요 같아요 담에도 카닥으로 ㅋㅋㅋ,2023-12-31T01:29:22-07:00,8.1.3,수완동 늑대
10753642963,Cardoc,ios,1,이앱은 호갱들이 사용하는 앱입니다 조심하세요,"최저가는 호구를 유입하기 위한 것 조심하세요 
70견적으로 갔다가 수리 다끝내고 130만원으로 바뀌었고 ㅋㅋㅋ 납득 안된다니 업체에서 그러면 차 못보내준다하네요 그리고 카닥에 문의하니 자기들은 해줄수있는게 없다네요  에효",2023-12-27T22:38:35-07:00,8.1.2,정말싫다
10745303619,Cardoc,ios,1,수리 ㅈㄴ 못함,티 오지게 남 이런곳만 소개해주는 어플,2023-12-25T19:09:56-07:00,8.1.2,ㅇ으뮤
10735345556,Cardoc,ios,5,항상 이용하는데 만족이요.,아무것도 모르는 여성 차주인데 대만족이요. 소심하게 전화해서 알아보기 힘든데 알아서 픽업 가능한 업테 견적 다 받을 수 있고 비교할 수 있어 너무 좋네요.,2023-12-23T06:30:54-07:00,8.1.2,ㅇㅅㅇㅇㅈ 90
10733948953,Cardoc,ios,5,처음 이용해본 카닥,"걱정 반 , 차 긁혀서 속상함 반으로 시작했는데 너무 만족합니다 가장 추운 날 고생 많으셨습니다 사업 번창하세요!!!",2023-12-22T22:27:48-07:00,8.1.2,와팡
10717590465,Cardoc,ios,5,좋음,이용하기 편해료 여자인 저도 편하게 카센터 잘 갈거 같습니다 서비스 쵝오,2023-12-19T05:59:39-07:00,8.1.2,도서관애용자
10715242179,Cardoc,ios,5,👍🏻👍🏻,👍🏻👍🏻👍🏻👍🏻,2023-12-18T19:45:59-07:00,8.1.2,브이텍와인딩
10691583870,Cardoc,ios,5,헉키누나,좋아요,2023-12-13T16:16:47-07:00,8.1.1,헉키누나
10687811523,Cardoc,ios,4,카닥서비스,"카닥 서비스 덕분에 저렴하고
효율적으로 수리 받게되어
카닥 추천 드립니다",2023-12-12T16:59:01-07:00,8.1.1,해피 대디
10687591174,Cardoc,ios,1,업체가 갑질하는 엉망진창의 구조,"1. 12월 4일에 수리를 위해 업체와 예약 진행, 예약일은 13일 오전 8시(픽업) 2. 약속 리마인드를 위해 12일 오후 2시에 업체 통화하여 13일 오전 8시 픽업 재확인 3. 13일 오전 8시 20분, 픽업 기사님 연락이 없어 업체 통화 진행해보니 아직 기사 매칭되지 않았고, 확실한 시간 약속 불가하다고 함 4. 곧 출근해야 하는데, 시간을 말씀해주지 않으시면 어떻게 해야하냐? 반문 5. 차키를 앞바퀴 위에 두고 그냥 출근하라고 함 6. 분실 시 누가 책임지냐, 탁송 업체 연락처 알려주면 내가 확인해보겠다 문의 7. 그렇게 부정적으로 나올꺼면 그냥 예약 취소해드리겠다, 취소하고 하지 마시라 라는 업체의 답변 예약을 9일 전에 하고, 어제 리마인드 통화까지 했는데 업체를 통해 받은 답변은 “그럼 그냥 취소하세요” 이런 업체 때문에 다른 선량한 업체들도 싸잡아서 욕먹는겁니다. 카닥 믿고 업체 예약했는데 돌아오는건 업체의 갑질 뿐이네요. 1급 아짚모터스 심지어 카닥플러스 업체던데.. 이런 티끌이 모여서 카닥 플랫폼에 악영향을 주는겁니다.",2023-12-12T15:36:13-07:00,8.1.1,리아시스트
10684909984,Cardoc,ios,5,도움되는 어플,차주에게는 필수적으로 있어야 합니다,2023-12-12T00:34:44-07:00,8.1.1,물포카
10684027682,Cardoc,ios,5,정비 서비스는 카닥,쵝오,2023-12-11T18:07:15-07:00,8.1.1,슈퍼또기남편
10683652045,Cardoc,ios,5,굿,굿,2023-12-11T15:30:26-07:00,8.1.1,정정장당쟝
10647617803,Cardoc,ios,5,신속 정확 견적 만족,"두번째 이용 
간편하고 카전문가들이랑 손쉽게 상담 비교 할수있어서 
차 고칠때마다 유용한 앱",2023-12-01T18:56:44-07:00,8.0.2,고니곤나
10644251300,Cardoc,ios,5,앱사용 과정이 다 무난함,좋아요,2023-11-30T21:18:30-07:00,8.0.2,알잖아요
10630546819,Cardoc,ios,5,"셀토스 문짝 교체, 도색","조수석 앞, 뒷문 크게 긁어서 뒷문은 교체 앞문은 도샛 진행했는데 너무 완벽하게 수리되었습니다
지난번 판금 도색 했을 때도 워낙 색상 및 외관 사고 전 새차랑 똑같이 진행해 주셔서 밑고 맡겼는데 언제나 친절하신 사장님 이번에도 완벽하게 새차로 만들어 주셨어요👍👍",2023-11-27T01:31:26-07:00,8.0.2,ㅇㅇㅇㅓㅓㅣㅏㅗ
10625611940,Cardoc,ios,5,친절하고  기술이  좋은  오토케어  짱짱!!,"일단  다른곳은  잘라서  용접  어쩌고  하면서  사고차량도  된다고  하고   진짜  심란한 마음가지게   만들었는데    오토케어 사장님은    판금 도색만으로   가능할것 같다는  믿음을  주셨고   수많은  후기에  버금가는  실력으로     착한 가격에  깔끔하게  마무리  해주셨습니다.  카닥견적 금액 그대로  맞춰서  해주시고
정말  감사드립니다.  덕분에   이젠  맘이  좀 편안해졌어요.^^",2023-11-25T17:22:55-07:00,8.0.2,루이 어니
10618153265,Cardoc,ios,5,좋은 착한 정비소 찾기,👍👍👍👍👍,2023-11-23T18:04:32-07:00,8.0.2,버키2세대
10582985945,Cardoc,ios,4,편리한 자동차 앱이네요.,"앱이 없었으면 일일이 근처 공업사를 발품팔아 돌며 견적을 내야 했을텐데, 덕분에 시간 절약하고, 차량 수리를 잘 받을 수 있었던 거 같습니다. 다만, 견적 업체가 좀 한정적인거 같아 조금은 아쉽긴 했습니다.",2023-11-13T16:23:29-07:00,8.0.2,브로딥
10580752327,Cardoc,ios,4,ㄱ ㅅ,굿,2023-11-13T01:39:23-07:00,8.0.2,ㅇㅇㅇㅇㅇㅇㅋㅋㅋ머
10566149924,Cardoc,ios,5,수리 견적 어디서 받아요?,여기 수리견적 여러군데에서 받을수있고 리뷰보면서 평가도 볼 수 있어서 좋아요!! 추천합니다 ㅎㅎ,2023-11-09T01:24:25-07:00,8.0.2,Jy891226!
10561749799,Cardoc,ios,5,좋네요,견적 빠르고 처리 빠르고 결제 빠르고 다 좋네요,2023-11-07T18:43:35-07:00,8.0.0,양bryan
10559173335,Cardoc,ios,4,수리가 막막할때 찾으면 좋은 앱,차수리시 공업사 찾기에 좋네요. 사진으로 수리비 견적을 내는 것에는 다소 한계가 있어보입니다,2023-11-07T02:12:45-07:00,8.0.0,코코로연애시작
10555690232,Cardoc,ios,5,좋은 앱입니다.,없었으면 어쩔뻔 했나 싶을 정도입니다. 엄지척!,2023-11-06T01:36:37-07:00,8.0.0,알영감님
10555103569,Cardoc,ios,5,사장님이 친절하시고 좋습니다,전부터 계속 이용중이지만 다른데 보다 진짜로 여기 매장처럼  친절한데가 없습니다. 한번 가 보세요 후회안합니다. 가격도 좋습니다.,2023-11-05T20:32:14-07:00,8.0.0,그랜저IG 쭌
10506562270,Cardoc,ios,1,알바쓰나요,"티가나도 너무남 
견적을 알아보다가 해당금액보다 더나오고 별로라 지웁니다
지인통해서 카탁보다 더저렴히 10만원 깍고 다시새차가 되었네요",2023-10-23T04:37:46-07:00,7.10.1,알려진바없음
10493979663,Cardoc,ios,5,너무너무 만족해서 리뷰 남겨요!,"숨고랑 카닥이랑 둘다 견적 진행하고 
리뷰와 가격이 합리적인 쪽으로 선택해서 
SM모터스로 선택하게되었습니다 *^^* 
카톡사진으로 진행상황 남겨주시고 꼼꼼하게 봐주셔서 믿음이 갔습니다 
픽업도 가능하시고 갖다주실때 회사로 요청드렸는데도 너무 친절하셔서 감동받았어요 ㅠㅠ 
다음에또 처리할일이 생기면 믿고 맡길수 있을거같습니다 사장님 인상도 너무 좋으세요😄",2023-10-19T19:15:18-07:00,7.10.1,샤테론
10491105401,Cardoc,ios,5,굿 어플,굿굿,2023-10-19T01:25:02-07:00,7.10.1,드가자히이
10476704809,Cardoc,ios,5,엔진오일,엔질오일 선택 하기편하고 교체 매장도 선택 하기 편합니다,2023-10-15T01:34:53-07:00,7.10.1,힘들죠
10472123457,Cardoc,ios,5,덕분에 차를 잘 수리했어요,앱 평가하는거 처음인데 굉장히 편리한 앱인 것 같아요,2023-10-13T22:19:41-07:00,7.10.1,Idea Frame
10467674656,Cardoc,ios,5,정말 만족스런 앱입니다,물론 사용할일이 없는게 최상이겠지만 ... 차를 수리할 일이 발생했다면 이 앱을 이용하면 신속 정확한 최고의 서비스를 받을 수 있을거라 느낀다,2023-10-12T18:02:24-07:00,7.10.1,가을바람속으로
10464424463,Cardoc,ios,2,쿠폰 사용 불편,"오일장 쿠폰 쓰는 절차가 정말 짜증나네요 자세한 설명이 필요합니다.
 다시
환불 방식으로 돌려주는것도 참 이상하고 지금도 언제 돌려 받을지 모름
불폄함",2023-10-11T19:16:09-07:00,7.10.1,주둥주둥주듕이
10458246955,Cardoc,ios,5,매우 좋아요~,"대부분 좋은점이 상당하니 단점과 개선할 점만
얘기 하자면 견적 업체와 채팅 할때 알림이 오면 해당 채팅으로 바로 전환되지 않는것이 아쉽다고 할수 있음.
카닥앱 들어가서 종소리 모양 눌러서 들어가서 채팅창에 도달하는것이 매우 불편함.",2023-10-10T00:14:14-07:00,7.10.1,알파치놈
10445460031,Cardoc,ios,5,좋은 서비스의 앱입니다,앱 자체 편의성은 조금 떨어지지만 서비스 자체는 정말 마음에 듭니다. 덕분에 저렴하게 잘 수리했네요,2023-10-06T08:20:09-07:00,7.10.1,보라빛호수
10444688964,Cardoc,ios,1,참나,그날 예약 취소했는데 6000원을 떼가네  별한개도 아깝다,2023-10-06T04:15:42-07:00,7.10.1,내마을로
10439344652,Cardoc,ios,1,좋은 정보 많이 받음,두번의 수리시 가격도 싸고 퀄리티 좋은 업체 연결되어 좋았음,2023-10-04T16:05:35-07:00,7.10.1,빅러브
10404936951,Cardoc,ios,5,사장님 수리  대만족스러웠습니다,"수리속도와 가격 퀄리티  만족스럽게 잘받았습니다
차량도  무료로 대차해주시고 수리가 빨리되서 신경써주신게  보였습니다  끝까지  만족스럽게  차량도  깨끗하게  세차되어 있어서  넘 기분좋았습니다  감사합니다  지인분들,차량수리할일생기면  또 찾아뵙도록하겟습니다  그때도 잘부탁드려요 :)",2023-09-25T01:19:26-07:00,7.10.1,jjong1109
10396904445,Cardoc,ios,5,내 차 수리는 카닥!,내 차 수리에 꼭 필요한 어플!,2023-09-22T19:09:05-07:00,7.10.1,Minho lee.호
10390061531,Cardoc,ios,5,엔진오일,싸게 교체할땐 카닥,2023-09-20T19:46:17-07:00,7.10.0,길거리생수
10383803311,Cardoc,ios,5,편리하고 좋아요,"너무 편하고 좋고 만족합니다
가격비교및 후기도 한눈에.. 아주 좋아요",2023-09-19T01:12:03-07:00,7.10.0,림앵두
10383536632,Cardoc,ios,5,왜이제야알았나요,너무좋네요 견적도 다 알아서 보내주시고...세상 좋아졌네요...,2023-09-18T22:52:38-07:00,7.10.0,밍밍ㅎㅇ
10379720863,Cardoc,ios,5,엔진오일이 친절하고 카센터가 잘 나가요,덕분에 좋은 곳에서 엔진오일 싸게 잘 교체함,2023-09-17T18:49:47-07:00,7.9.1,다코타존슨팬
10366397433,Cardoc,ios,5,휀더 돌빵 녹슨 곳 수리했는데 만족합니다,"몇년 전 휀더에 돌빵 제대로 찍혔었는데 그대로 두었다가 범위도 커지고 녹슬어서 이번에 수리하기로 했습니다.
물론 견적도 중요했지만 사람들 후기 보고 예약했는데 아주 만족스럽네요!! 
예약부터 사장님 너무 친절하시고 딱 말씀하신 시간에 다 되어서 차량 맡긴지 6시간도 안되어서 기대했던 결과가 나왔어요ㅎㅎ
다음에 또 필요시 의뢰하려구요~!",2023-09-13T23:41:00-07:00,7.9.1,모모모들리
10362259169,Cardoc,ios,4,견적 삭제,견적서를 받으면삭제가 됬으면 좋겠다,2023-09-12T16:39:39-07:00,7.9.1,멍 기
10359499762,Cardoc,ios,3,굳 좋네요,가격 비교해서 수리받을 수 있어서 좋네요,2023-09-11T20:51:41-07:00,7.9.1,엄써엄써
10345903840,Cardoc,ios,5,이제 여기저기 전화안해도 됩니다,비교해볼수있고 후기도 볼수있어 안심하고 맡길수있구요 알아보는 시간도 줄일수있어 좋네요!,2023-09-08T00:24:42-07:00,7.9.1,초운자
10343395385,Cardoc,ios,1,장난합니까,캐롯퍼마일 보험은 애초에 차량 기입이 안되게 해놨는데 어떻게 해야하나요,2023-09-07T06:31:16-07:00,7.9.1,ㅁ어ㅓㄷㄴㅌ
